,thewestwing
728,"20 Hours in America - is Josh getting a bad rap? During my rewatch (and subsequent listen to the West Wing Weekly take on it) the consensus seems to be that Donna is completely right in going off on Toby and Josh for their behavior during their ""planes, trains and automobiles"" odyssey.

*""I am not kidding. I have such an impulse to knock your heads together. I can't remember the last time I heard you two talk about anything other than how a campaign was playing in Washington. Cathy needed to take a second job so her dad could be covered by her insurance. She tried to tell you how bad things were for family farmers. You told her we already lost Indiana. You made fun of the fair but you didn't see they have livestock exhibitions and give prizes for the biggest tomato and the best heirloom apple. They're proud of what they grow. Eight modes of transportation, the kindness of six strangers, random conversations with twelve more, and nobody brought up Bartlet versus Ritchie but you. I'm writing letters, on your behalf to the parents of the kids who were killed today. Can I have the table, please?""*

To unpack this, in the opening scene in part 1, Josh seems to be listening to Cathy, while Toby is losing it about President Bartlet's delivery of the speech.  He solicits advice, and is trying to give examples of their struggles.  It's \*Toby\* that says that they were going to lose the state.  Josh didn't hear the bit about Cathy taking a second job for the insurance, because he was in the back of the truck with Cap and Toby.  Yes, he mentioned being briefed about the fair because he was anxious being out of touch, but it wasn't especially dismissive (for Josh, anyway).  And we saw - twice, although Donna only witnessed it once - people say that ""Didn't vote for \[Bartlet\] last time, don't plan on voting for him this time"", and Tyler's friends were also anti-Bartlet, so it wasn't just them talking about the election.  

In the meantime, Josh actually thanks Cathy and Cap, and Tyler.  His point in the running argument with Toby is trying to pay attention to the issues that matter to the voters and not making it about being the smartest kid in the class.  To win, not to beat down Ritchie.  

Yes, Josh does Josh-like things.  He puts his foot squarely in his mouth talking about Cathy to Cap.  He gets pretty racist when he talks about ""Mohammed al Mohammed al Mohammend bin Bizir"".  And apparently he's the reason they had to walk three blocks in the rain (although he did give Donna his coat).  And maybe this was Donna blowing off steam they way Josh and Toby had been all day, but she looks directly at Josh when it was Toby who was the source of most of their frustrations.

Then again, it led to the Matt Kelly scene, which was great and led to a great bit in ""College Kids"""
729,"Amy’s departure Did i miss a scene where josh and amy break up for good? I feel like eventually she just stopped showing up. When she did come back, she and josh were broken up"
730,“I didn’t know funding was available” 
731,"I believe u/Irate-Swami posted this a bit ago, but I wanted to bring back up the discussion because it genuinely interests me. How many of you have/had a career in politics because of The West Wing? "
732,"Indians In The Lobby C.J.: ""How do you keep fighting these smaller injustices when they're all from the mother of injustices?""

Maggie Morningstar Charles: ""What's the alternative? ""

The writers of this series are all geniuses."
733,"Great Lines Delivered Memorably by Supporting Characters Aaron Sorkin wrote many great lines for his primary characters, but some of my favorite lines were delivered by characters we didn’t see very often. Some, in fact, were from characters we only saw once. What were yours? Add your favorites and let’s see which ones are the most popular."
734,"Trying to convince someone to watch... I'm currently on my first rewatch of the show and I realized, all over again, how amazing this show truly is. My friend is looking for a show to watch on Netflix, and of course, I suggested The West Wing. I've given him a lot of reasons to watch: the characters, the drama, interested in politics, and the amazing writing throughout. I was just wondering what other people would say is the best reason to watch the show?? "
735,"Danny Concannon Just starting watching the West Wing for the first time. Only half way through the first season at the moment, but I do enjoy the story between CJ and Danny Concannon. He seems like a genuine good guy."
736,"On The Day Before This is one if my very favorite moments in the show...

Leo: ""Take the immunity.""

Charlie: ""I'm not allowed to...""

Leo: ""Take it.""

Charlie: ""Is anyone else taking it?""

Leo: ""No one else is being offered it.""

Charlie: ""Would they take it if they were?""

Leo: ""Charlie, who the hell knows what's going to happen with this prosecution? It's a partisan prosecution. You could go broke. You could be barred from law school.""

Charlie: ""Doesn't immunity imply guilt?""

Leo: ""Not necessarily.""

Charlie: ""And if someone in my position took a deal to protect himself... What would that person be saying to his employer? That they were wrong to trust him?

Leo: ""Don't be a hero.""

Charlie: ""Why not? I'll stay with my team. People should stop trying to get me not to do that.""

Margaret: ""Leo...""

Charlie: ""Anyway, I'm not supposed to talk about it.""

Leo: ""Yeah, okay."""
737,"Rewatching ""Gone Quiet"" All I can say is I LOVE ALBIE DUNCAN! What a great character."
738,"Gone Quiet I'm as big a WW fan as any, and I'm still puzzled as to why Oliver Babish said to Abby, ""You're not a medical expert."" According to the Duhaime.org legal dictionary, a medical expert is ""A witness tendered to offer opinion evidence within the confines of his or her area of medical expertise."" Abby has been an MD for 26 years. Can anyone explain why she is not a medical expert?"
739,"In S06 E16, Toby says this about his brother David who committed suicide. Moments earlier he was shown angry with Josh for 'dropping everything and walking away'. "
740,Season 5: Episode 08: Shutdown - Not quite Abby's cooking... 
741,What episode is this from? I remember either Toby or Josh visited a black congressman/senator and they asked if they could stay while the statesman called the families of people who died I believe
742,"First time viewer ever, does it get better past season 4? I started watching about a week and a half ago and was instantly hooked! My concern now is in season 4 the tone of the whole show seems to have changed, it feels really dry now and my attention wanes more with episodes. Will’s character really bothers me, I can’t see him fitting in the groups dynamic and it really throws me off. Everybody really seems confident about their roles and abilities in the White House, and then there’s Will the super anxious and unsure addition to the team. Well anyway, I’m about to finish season 4 and will take a break from the show. I’m pretty certain now Will’s character is the main reason why I’ve lost that initial obsession for the show. Thanks!"
743,"Designated survivor 2x11 ""grief"", Danny makes an appearance as a councilor. "
744,"""Hey Joe, it's me, can you help me out?"" And the friend jumps in the hole. Our guy says, ""Are you stupid? Now we're both down here."" The friend says, ""Yeah, but I've been down here before, and I know the way out."" "
745,Love for the much-maligned Lord John Marbury 
746,Indeed he will ... 
747,The Santos Lyman reunion on Brooklyn 99 made me quite happy 
748,"What's the most ridiculous sub-plot or character backstory ever introduced in TWW? Dedicated viewers love the characters and situations created by Aaron Sorkin and the other writers, but in seven seasons there were bound to be a few clunkers. Which of these colossal mistakes in judgement do you think was the worst?"
749,First Lady becomes easily one of the worst characters during the abduction Seriously how can she be so mad about Sharif and not discussing it with her.  It's National Security.  The First Lady doesn't get to get in on decisions of national security and defense.  She should have known better.  I really hate how the writers turn into such a witch who things that she's the President too.
750,The 20 Best TV Dramas Since ‘The Sopranos’...and guess what's first? 
751,Sam didn't say the wrong name. Kyrgyzstan does have nuclear weapons. 
752,"Duck and Cover -- Nuclear plants near population centers In Duck and Cover, while discussing the nuclear power plant which is having a major accident, Helen Santos wonders aloud about placing a nuclear plant that near to population centers, and Congressman Santos says they are all near population centers because otherwise ""too much power is lost"" while it's transmitted.

This doesn't sound right. Hydroelectric dams are normally a long distance from population centers; is there some difference between the transmission of the two?"
753,(Thousands sign petition to merge Dakotas into 'MegaKota') Seeing as how I just watched the episode where Donna is sent to North Dakota to drop the word North... I think this is applicable lol. 
754,"Dropped storylines. I'm doing my first rewatch of the West Wing after previously watching the whole show about ten years ago. Right now, I'm at the end of season 3. 

Everyone knows that Sorkin has a habit of dropping characters out of the blue. During this rewatch, I'm noticing his habit of dropping major storylines too. Or at least wrapping them up *way* too quickly. Allow me to give some examples. 

* The President's MS. The last five episodes of season two focus on the huge fallout it will cause when the world finds out. It ramps you up to expect an enormous fight that lasts a season. But within ten episodes, Bartlet has accepted the censure and any suggestion of repercussions basically end. The story is dropped, and the focus shifts completely to re-election. 

* Leo's addiction. Once again, they make a huge deal about how much of a fight Leo has on his hands. Then they cut a quick deal and the story is dropped. 

* The aftermath of the shooting is time-lapsed in one episode (midterms). I get why this did this from a story point of view, as you can't have Josh recovering for half a season. But it's one of the biggest events in the Bartlet administration, and it's pretty much skipped through. 

Other notable examples include the breakup of Leo's marriage, Sam's relationship with Laurie being exposed, and Josh's PTSD. 

Basically, I'm asking if anyone else has noticed Sorkin's habit of spending more time on the build-up than he does on the event itself? I'm not criticizing the show, by the way. It's just something I never noticed during my first run-through, and I'm wondering if anyone else feels the same way. 
"
755,"Leon Panetta, the man Leo was based off of, is on PBS talking about the shutdown that happened when he was chief of staff in the bush administration which is exactly what that episode of the west wing is based off of and I have no one to share this with that would get the reference except for this sub."
756,My Political Science Professor: “We’ll be watching an episode of the West Wing every Friday.” Me: 
757,More talk on having a West Wing Reboot - only it won't actually take place in The West Wing... 
758,"When Josh walks around Donna whilst placing his hands on her hips Hi west wingers! Trying to find the episode where Josh is in Donna’s bullpen area, and when he goes to go around her, he puts his hands on her hips/waist - anyone know which episode this was?
Thanks😃
"
759,Our favorite republican getting some well earned recognition 
760,"My favorite scene I’m sure this scene has already been discussed on this sub before because it’s too good not to, but i searches and couldn’t find it. When Will comes to see Toby before he officially works at the white house and they’re discussing the second innagural. They compare 500 word-essays or whatever and Toby has will stop reading his because Will’s is much better. Toby discusses the slump he’s been in and how he had hoped to be one of the all time great speech writers. It’s probably the best look into Toby that we ever get. To top it all off, will gives toby the letter from sam that says “he’s one of us.” The message is so simple but it almost made me cry because it’s somehow weirdly the best part of sam and toby’s friendship, how despite all their bickering, they’re the only two who truly understand each other, and now will is one of them. Then comes will’s greatest moment where he leaves to go on vacation, then turns right around and asks, “unless you want to start right now?” and toby’s like “yeah.” The scene is perfection from start to finish and i’m obsessed with it. I had to rewind it as soon as it was over. Sorry for the rambling description, go back and watch it! "
761,"Gaza Right after the president's call to Congressman Korb's wife...

President Bartlet: ""Charlie, when your mother was killed you got one of these calls?""

Charlie: ""Yes, sir. Her captain.""

President Bartlet: ""It make you feel any better?""

Charlie: ""Not really, sir. Nothing makes you feel better... But it did make me feel proud."""
762,"Assistants I'm doing a rewatch of the series and what's really standing out to me this time is how awesome the assistants are. They have fantastic moments of humor, like the muffins in the commissary. They also care so very much about the staffers. Obviously the main example is Donna and Josh, but there are tons of little moments too, like Mrs. Landingham running out of the room when the news announces the Roslyn shooting. I just got to Enemies Foreign and Domestic, and the cold open is so great with Carol reading the news report on the Saudi Arabian girls who died in the fire. She knows CJ and knows how CJ will react so she brings her the report immediately and stands there completely focused on CJ despite Toby and Sam bantering. It's such a great moment with Carol focused on CJ. I love these characters. "
763,"A small mistake i noticed in S01E04 - Five votes down Started my 1st rerun yesterday !

E04, when the president finishes his speech and steps into his motorcade / car , the motorcade doesnt start immediately but instead waits for his staff (leo, josh, cj) to get into their cars as well, and the staff also happens to be seated in the car in front of the president.

Not sure if :

1.The president's motorcade will wait after the president has stepped inside the car. It's a crowded place they will prefer to get moving immediately.

2.The president will wait for his staff while they chat outside with the public.

Maybe im nitpicking too much ?"
764,"And Its Surely To Their Credit When C.J. is telling General Barrie he wont be speaking to Tim Russert she calls him out for wearing the Distinguished Combat Service Medal that is unearned. Good catch, but seems she missed the big, obvious Combat Infantry Badge all bold and blue above. 

I dont know what I wanted here but it just seems like missing a redwood for a fern. "
765,What happened during the gov. shut down? Can someone remind me what caused the shut down and how it was resolved?
766,"Mallory’s significant others In S1E12 Abbey is ribbing Mallory about having “an itch” for Sam. Abbey goes on to say, “Don’t go for the geniuses, they never want to sleep.” In a later season, it is revealed that Mallory married/dated a hockey player. Looks like she took Abbey’s advice. "
767,Richard Schiff Confirms Talks Of Long-Rumored ‘The West Wing’ Reboot 
768,"“And It’s Sure To Their Credit” (s2e5) - Tribbey and the Dead Flowers EDIT - obviously I meant “surely” up there...

I was looking at an old thread on the scene when Sam fires the two a-holes, and there’s always been a question in my mind about it. The way Tribbey jumps in with his “Oh yes. He can. Now leave here and don’t ever come back.” It seemed so ... strange and out of character for him. His tone of voice was so sarcastic (as it always was). And his most recent interaction with Ainsley was bad - he didn’t have any reason to come around to respecting her like the other staffers did. In fact, she called him out. 

Don’t hate on me for this - I know it doesn’t make total sense - But ever since the first time I saw the episode (when it aired), I’ve been under the impression that TRIBBEY left the dead flowers (not the two guys), and his “leave and never come back” was a cover. As Sam pointed out - no one signed the “Bitch” note. But also - Sam never actually tells them the reason he’s firing them, so they never actually confront him about it, confirm it, or deny it. And Tribbey supposedly has no idea what’s going on - ALL HE KNOWS (unless he knows more, already....) is that Sam is firing them, yet he abruptly jumps in to back him up without hearing anything about the dead flowers.

To me, watching it initially, it seemed so obvious that that was what was happening - That Tribbey left the flowers and found a perfect opportunity to get away with it, because he’s slimy and only cares about drinks with little umbrellas in them (“SHISH KABOB!”) It doesn’t seem like ANYONE else saw it that way, though...?"
769,Well here's a thing... WW reboot? Schiff is in... 
770,"she may not have been the best fit for the show, but she doesn’t deserve half the hate she gets "
771,"Is Cliff Calley a good guy? I've been trying to listen to the West Wing Weekly episodes as close to concurrent as I can (watching episodes at night, listening to the episodes at work the next day) and I found Josh Malina's take in the episode for [H. Con-172](http://thewestwingweekly.com/episodes/310) , on Cliff ""helping"" Leo, to be interesting.  Cliff talks about waiting in the ""tall weeds"" for Gibson if he went after Leo in the hearing., but Malina suggests this is a way to save a bargaining chip for later, and that Cliff isn't a good guy at all.

My original take was more like Hrishi's in the episode, that Cliff is a good guy and is trying to make this go away.  But now I wonder if the truth is in the middle.  Going after Leo might have scored a few immediate political points, but would also make, as Cliff said, ""good people hate"" the Republicans.  If the end goal was always to censure the President, then it makes sense that Calley would try to use the threat of Leo's exposure to facilitate that end.   Especially if they knew what Ainsley found out, that the Administration was full of good, righteous people, and specifically what Cliff may have known from reading Donna's diary that no one actually knew.  Calley may have understood prolonged hearings would damage the Republicans even as it did in real life with the Clinton impeachment hearings.

This darker take might be the only way Joe Quincy is able to say what he did about Josh's PTSD connection to music - that it had been in Donna's diary and Calley let it drop at some point.  

I'm still inclined to think Cliff isn't a really bad guy, not nearly the person Josh Malina paints him to be, but I can see him being a bit more calculating that I originally thought.  I do think he had genuine affection for Donna, tho'.

&amp;#x200B;"
772,"Season 4 episode 19 angel maintenance Researching the whole series, again, loving it!

Just saw, that they call out for a f16 fighting falcon outside air force one when in fact it's a f15.. fun to see more details during researching :). What are your best findings? "
773,"I’m rewatching for first time and starting to make a list of top 5 favorite scenes in the series. What’s yours? Starting my first rewatch of the series and already have noticed so much more this second time around. I’ve already come across a few scenes that blew me away with the language, like the basketball scene in Season 1, so I’ve started keeping track. I want to come up with my top 5 favorite scenes in the show. What’s yours list?

Edit::  I told you all that I am rewatching. The Let Bartlet Be Bartlet turning point in season 1 episode 20 is a great one. "
774,"This scene from ""We Killed Yamamato"" with Leo and Fitz is one of my favorites - ""You're talking to me about international laws? The laws of nature don't even apply here!"" "
775,"Finished first watch Just finished the season finale yesterday (well technically today at like 3am) and after I finished it, I just felt kinda empty. But now that I’ve had time to process it, I am feeling all of the emotions: happy, sad, overwhelmed. It was so bittersweet. 

I could spend a while talking about the finale, but I’ll just talk about my two favorite parts: Donna looking around her new office as Chief of Staff, and CJ leaving the White House. Those were both really amazing moments for me. Watching Donna grow as a person and work her way up to higher positions was one of my favorite storylines, and the look on CJs face when she told the man she didn’t work at the White House and walked away was satisfying. CJ was the first character that I liked and the only character that I’ve consistently liked through all 7 seasons. I’m so glad she ended up happy doing what she wanted to do. Oh, and Bartlet giving Charlie the constitution. That made me actually cry. 

With that being said, I wish the original group all had one last goodbye together in the Oval Office or something. Might’ve been cheesy, but I still would’ve wanted it. 

Starting this show, I wasn’t sure what to expect. You hear a show is critically acclaimed and think, “ok, this show has got a lot of praise from people. I’ll probably like it.”  This critically acclaimed show puts other critically acclaimed shows to shame. (Seriously, some shows should not be considered critically acclaimed.) I know a lot of people love this show because it gives them hope or it’s an escape from reality, and while that was true for me as well, what really got me hooked right away was the dialogue and acting. The dialogue is something else, like nothing I’ve seen in any other show. The acting was superb. I figured Martin Sheen and Allison Janney would be great since I’d seen their work before, but since I had never heard of anyone else I wasn’t sure what to expect of them. They didn’t disappoint either, especially Richard Schiff.  

While Sorkin’s era of this show was superior, I was so glad, and pleasantly surprised, that I still enjoyed s5-7 enough to keep watching.  I was scared I wouldn’t like it because of all the horrible reviews about s5 (unpopular opinion: it wasn’t that bad.)

This is a show I knew I would rewatch many times before I even finished it. I wanna rewatch it now, I’m already going through withdrawals, but I have some questions: should take a break before I rewatch it, or watch another Sorkin show? Also should I listen to west wing weekly? I’ve heard mixed reviews. 

(Edit: the only other show I would put on this level is FX’s “the Americans”. Both shows are different, but very extraordinary.)
"
776,When my wife wakes up at midnight and discovers me watching The West Wing and eating nachos... 
777,"My rewatch has reached season 5 and one thing has always bothered me In season 5 Bradley Whitford gets a haircut. It throws me off every rewatch. The hair isn’t puffy, and it stays that way through the most of season 6, then reverts to the hair he has the rest of the seasons. It’s definitely shorter on the sides in the Supremes, and season 6 the back is shorter too.

I’ve though that maybe it was a commentary on having more time devoted to personal upkeep after leaving the White House, but it’s shorter before he leaves...and I know I’m overthinking.

Has anyone else noticed this?"
778,The West Wing Homework Chart 
779,"The commandments In the first episode Toby argues about which commandment is which. Can anyone tell me why?

Thanks!"
780,[SPOILER] Watching though again. Just got to ‘Posse Comitatus’ Simon Donovan gets me everytime. 😔
781,"Shutdown Is it just me, or are we living this episode? I mean, the positions of the parties are reversed, and nobody on the Republican side is as smart as Haffley (I say that as someone who wishes more people in the party were like Haffley and Walken and Cliff, aka respectable conservative politicians). But still...is life imitating art here? And, if so, can we get Pelosi to yell about an equitable agreement, like, yesterday?"
782,"What happened to Lionel Tribbey? &gt;I will kill people today, Leo! I will kill people with this cricket bat, which was given to me by Her Royal Majesty Elizabeth Windsor, and then I will kill them again with my own hands!

Lionel Tribbey was hilarious!  I know that Bartlet's first term had a revolving door of White House Counsel staff, but why didn't Sorkin keep Tribbey on for longer?  "
783,"Why did Josh care if Charlie was gay? I was rewatching one of the earlier episodes, and in the scene where Josh is interviewing Charlie, he says he has to ask ""some questions about your personal life,"" at which point Sam jumps on him for asking if Charlie is gay. I was confused the first time I saw this, but assumed it would be addressed later, and as far as I've seen, it hasn't. The only thing I could think of is potential political backlash if people found out, but that concern doesn'f seem to fit the tone of the Bartlet administration. 

Edit: thanks for all the great answers! This part makes a lot more sense to me now. "
784,My friends and I went through a fair bit in our lives in 2018. Decided to put together a late Christmas present for us all. 
