,thewestwing
535,"Wants some opinions on “Full Disclosure” S5E15 *Spoiler* What did you all think of the CJ-Hoynes situation? The first time I watched I thought it was stupid fodder to add a new depth to CJ but on the most recent watch(4th or 5th watch) I saw it as a good character growth for CJ in moving on and her regret over the incident. Plus it finally got her on the phone with Ben, which made Carol happy for about 5 minutes which is always nice. 

Anyway. What’s your thoughts? Because even as I type this I’m going back to the fodder opinion. Can’t make up my mind. "
536,Current events between India and Pakistan Has anyone else been asking themselves if Pakistan has put Command/Control into the field?
537,"Was Charlie the real focus point of the series? Of course you see every angle and every character. He was not in ever episode either but step back and look at it as a whole. Everyone went to him for advise and he seem to embody the only ""Normal "" American with screen time. It could just be me but I wanted to put this out there for thought. I have watched the series on Netflix about 7 or 8 times now and i love listening to it when playing videos games and working in general at my PC, just so you don't think I'm going off a fly by night viewing."
538,Recognize Anyone? 
539,"Season 4 episode 14 detail Was just watching s4:14.  Two minutes in, Josh and the President are talking about his foreign policy shift.  The conversation culminates in the President saying:  'Well, their curiosity will be slaked in about 41 minutes'.  Right as Bartlet says '41 minutes', there is exactly 41 minutes left of the episode.  Thought it was kind of a neat detail!

Edit: punctuation"
540,Psych wasn’t the only show to do a WW callback 
541,I was watching Psych and I found a WW reference. 
542,"Painting a quote from the show- ideas? I want to paint a quote on a canvas but I don’t know which quote to paint! There’s too many I like to narrow down 

I think my favorite quote/dialogue is Leo’s speech to Josh at the end of Noel, but it’s quite long (for a canvas) and I don’t want to paint just part of the quote, so I’m looking for other ideas. 

What are your favorite quotes from the show? If you had to paint one, what would it be? They can be emotional or funny or serious. 




"
543,"Hoynes’ resignation and the staffer President Bartlett seems to make a big deal out of the fact the the staffer who delivers Hoynes’ letter of resignation arrived to the White House in a taxi. Instead of dropping it after she misses the question, he asks again. Is he suggesting (or suspicious that) the staffer had spent the night at the VP’s place? It was raining and wouldn’t be crazy to think someone who typically would walk or take the bus might spring for a cab on such an important and early-morning errand. "
544,"Sorkin and speechwriters To all my American friends - I would like to understand how important is the role of a speechwriter in the White House, when it comes to policy. I would think that it would be policy decisions that would affect speech writing and not the other way.

But Sorkin on his shows portrays a very high importance on these roles- Toby and Sam in TWW (Sam was supposed to be the main lead in the beginning of the show) and even Will in the newsroom.

So I would like to understand if it is accurate or maybe a little exaggerated as Sorkin himself is a writer?"
545,"S5E1: 7A WF 83429 – Just noticed the shadow split across Leo, symbolizing being split between his loyalty to President Bartlet and his loyalty to the Oval Office and President Walken "
546,"Currently binging for the first time on Netflix and I just got to Noel. My god what a fantastic episode. Josh so far has been one of my top characters and his story in this episode was just so masterfully done. Kudos to Sorkin for the beautiful writing, the build-up to Josh finally revealing how it actually happened was edited so well and the tension was so strong. 

The abrupt ending got me for a little but my god Josh and Leo's convo hit me emotionally more than I thought this show would. What a fantastic episode, my god"
547,"“Yeah but I’ve been down this hole, and I know the way out...” "
548,"Series 5 - 7 : Sorkin stays on Given all the whining we get about ""how bad"" and ""how appalling"" and ""what a total and utter betrayal"" Series 5 - 7 were, what do you think Sorkin would have done differently if he had stayed on? 

You can be as specific or as general as you like :) "
549,This has to be the only case where pitching to Toby is the more pleasant option.... 
550,"Where on left do each of the West Wing characters lean? For example, who is the most liberal of the characters. Jed is relatively conservative on some social issues (abortion at least in 99) so I would imagine he's a bit more moderate, but who would we characterize as progressive or moderate among the staffers? Is Josh left of Toby, where's Sam and Will, CJ, Leo, etc?"
551,On The Good Fight... 
552,My boss is the most Toby human I’ve ever met - this is now his ‘Friday shirt’ 
553,"Following along with all the Reboot Idea’s.... Doesn’t Congresswoman Wyatt make a lot of sense? [Andrea Wyatt(-Ziegler?) for president](https://imgur.com/a/b37VSw6)

[I was Inspired by this post](https://www.reddit.com/r/thewestwing/comments/asy9jq/if_were_giving_reboot_ideas_heres_mine/?st=JSG9YL1X&amp;sh=f8afdc07) and then thought to myself seriously wouldn’t Congresswoman Wyatt make an excellent POTUS storyline in a reboot: 

1. A Female President ✔️ 

•Follows almost all current TV network trends.

•Definitely could serve to add even more to Sorkin’s specific brand of political idealism. 

2. She automatically injects countless opportunities for conflict. Her campaigning alone would takes us through numerous rollercoasters and of course even more while she was in office ✔️ 

•First off Toby’s connection to her alone serves this purpose. 

•Add in those pregnancy lawsuits. 

•Even her own season 7 (likely)come from behind congressional win, after having always won her district with 85% of the vote, all because Toby was charged. 

3. Andy Wyatt definitely provides probably the most legitimate reason’s to include or call back to serve, most if not all of the original ensemble ✔️ 

•They all served as trusted advisors to Bartlet together (think Debate Camp). 

•They all seemed to be roughly the same age/generation. This makes a lot more sense if you think about it-Bringing back what would be considered a much older administration with Charlie young as President would be harder if they all came right back into the WH and with Wyatt this plus they could all maybe even return with some as Sr staff. This is just more plausible with her. 

•Wyatt already worked with all of these political operatives why would she even change that? 

4. Wyatt would even be one of the easiest way’s for Sorkin to write the party politics the same way he did in the original ✔️ 

•Her political views mostly lined up with Bartlet’s Administration. 

•Her history would have obviously much more likely stayed the same course politically. 

5.She even sorta opens the door a little wider for old recurring only characters. 

•For example Amy could return with some pretty awesome storylines 

• This maybe gives Donna a much better shot at a more deserving role in an administration. 

•Especially since both Donna and Amy served in Santos administration and just as Amy was Abbeys COS Donna was Helen’s. 

•**But lets get to what’s really the most important here....I personally feel Andy was obviously always pretty tight with Ed and Larry and for me there’s simply just no possibility for a reboot without Ed and Larry!** 

6.She is probably the only possibility that really serves to legitimize Toby’s return well! 

*I’m just saying Congress Woman Wyatt really makes so much sense here and imo the most important reason for that is because so far she would serve as clearly the easiest way for Aaron Sorkin to overcome the major Toby problem which would absolutely be a gigantic obstacle for him.*

*Richard Schiffs Toby is one of Sorkin’s personal all time favorite characters he has ever written.  He says this a lot. Wyatt for president really does almost instantly overcome that objection and at the very least provides Sorkin opportunities that since S7 are very necessary for him to continue to write Toby Ziegler.*

*If anyone was actually going to get Toby back in the WH Wyatt for president is seemingly the only feasible way I can see that *somewhat believably* happening. Not to mention the much needed “friction” and “conflict” that would create for Sorkin to use in his typically dialogue heavy screenplays.*

*I can also see Wyatt not only bringing Toby back via the WH residence (which is of course the simplest way to do it, either Andy and Toby married or through the Twins personally either way works for me I love Toby too!) but imo it could even make the argument an easier one if it happens to be made by Wyatt, if anyone can make the argument to the public and the audience that Toby serve’s as a trusted advisor to any president again it’s gotta be Andy. Right?*

7.On top of all of that even the flashback-Cameo method could possibly be used a little easier with Andy Wyatt as President, but I really don’t think that’s necessary if they made this choice.  

imo the more I think about this it almost serves (maybe a little to perfectly) all of Sorkins needs to revisit the series. 

I can’t lie though I personally actually really want to see Sam Sea*Born for president* or Charlie Young as president. I just think Andy is the much more feasible option here. "
554,Think Josh found the real deal in Nashua? 
555,"Does anyone else find the way that Lou says Oregon in Election Day: Part 2 odd? Seems like she says it Or-eh-gone instead Oar-gan. Is this some kind of regional thing? Everyone else seems to say it the normal way. I’ve searched around to see if anyone else has discussed it, but I’ve come up empty. I just don’t understand why she says it that way and it bothers me probably more than it should. Anyone else have an opinion? It occurs twice I think, once around the 25 minute mark and once before that."
556,"I have a note pad on my phone for my ""high thoughts"" I opened it and read this. Apparently high me is tired of waiting for a reboot... "
557,The Mercator Map 
558,Aaron Sorkin’s “Wording” on ‘The Late Late Show’ has me worried about ‘The West Wing’ reboot rumors too... 
559,If we're giving reboot ideas here's mine! 
560,Leo's Red Shadow Box One thing I've always wondered is what's in the red shadow box on the wall behind Leo's desk. It looks like pins of some kind. It can't be military decorations because they're metallic and there's far too many of them. Anybody have an idea?
561,"A Conversation About Sorkin So I wanted to get some other folks opinion regarding my opinion of Aaron Sorkin.  First off, I'm a huge fan of almost everything he has done.  My IPad is littered with his movies, his TV shows, etc.  I probably have watched more of his stuff than any other screenwriter out there.  There is something that does bother me with his writing though.

I've been watching a lot of his movies lately.  Molly's Game, The Social Network, Moneyball and Jobs specifically.  All of these are movies I really like but there is one issue I have with them and it is the artistic license he seems to take with real people, ones that are also still alive.  My examples are below (and maybe I'm wrong about a few so please correct me where I am wrong):

- Moneyball:  That movie made Art Howe look really bad and he was not that against the Moneyball approach according to him.  Art has had to defend himself in print about this which I think is incredibly unfair.  Make Reese from The Newsroom look bad, fine.  Make a real person look bad when they weren't, I have an issue with that.Also, it's not as if the A's didn't already still have all-star pitching.  

- Molly's Game:  I'm totally fine with the Idris Elba being the ""eyes of the audience"" and not being real.  However, from what I understand is that Molly's main accident didn't occur the way it was depicted in the film.  The main motivation of her going to LA is based upon a false presence, which is fine in a made up story but it's hard to keep with that in a ""based on a true story"".    Also, the conversation with the father (I love Coestner in this film) never happened.  

- Jobs:  Again, my understanding is that all of the fights/arguments before the presentations never happened and the feelings of Steve W and others were misrepresented.  

Again, I'm a huge fan of Sorkin but it's these items just seem like plot devices and are not true to the story.

Anyway else agree or am I nuts?"
562,"Favorite Comedic Moments? Some of the best comedic moments off the top of my head are:

* [When Abby has the White House band play the Canadian National Anthem for Donna, and Jed comes in yelling ""What the hell is going on?  I was gone for 45 minutes, they were all Americans when I left!""](https://www.youtube.com/watch?v=Ij9rl93FSFQ)
* [When Albie Duncan and Leo are speaking in the Oval Office and Jed starts slamming his head against the Resolute desk after having to listen to Albie criticize him.](https://www.youtube.com/watch?v=9Phfbkb1I88)
* [When Josh is trying to interact with the users of LemonLyman.com, he tells Donna that ""the internet people have gone crazy"" and she responds ""you're kidding"".](https://www.youtube.com/watch?v=7jiUnPFHhcY)
* [When Charlie calls the residence for Jed's wake up call; ""Who the hell is this, and what could you possibly want?""](https://www.youtube.com/watch?v=IxdAZwcqGIk)"
563,"Nth watch thru— Drought Conditions Does anyone else just want to wrap Toby up and give him a big hug? As I've posted before, when the old dudes cry on the show, it gets to me, but this is the first time Toby's tears really got to me."
564,Happy Presidents Day! 
565,CJ Warned Us. 
566,"I didn't realize how much Sam looks up to Toby till S02E17 CJ asks Sam ""Who's your favorite writer.""

and without a second of thought or hesitation, Sam says ""Toby"""
567,The President and his Press Secretary came to visit Dulé Hill in Los Angeles. 
568,"Eppur Si Muove - a failure to follow up? The recent discussion of the Bartlet sisters had me thinking about ""Eppur Si Muove"", and the writers failing to follow up on it.  In a sense, I recognize they \*had\* to ignore the ramifications in order to generate the drama of the next year, but these lines: 

WILL You're going to need to tell the President, sir.  

RUSSELL Am I?  

WILL It's going to come out, sir. The list is all over town.  

RUSSELL Well, maybe that's not so bad. It wasn't my plan, but it might be a happy accident. Just the thing we need to put a little distance between us and them. I wouldn't worry about.

If the story that the Vice President leaked information that put Ellie in the cross hairs had come out, the Russell campaign would have been dead in the water.  Russell would have been frozen out by President Bartlet.  

I don't blame them for dropping the story line, and I generally enjoy the episode (particularly the Sesame Street bits, it even made me tolerate Elmo), but it's hanging there.  That Russell was that arrogant and stupid, he really didn't deserve the nomination."
569,Grocery store honoring President Bartlet today. 
570,"I swear once TWWW is done I’m gonna watch the series at warp speed I’ve been trying to stay on pace with the podcast as best I can, getting at most two episodes in front of the pod, but this is tortuous 

I know I can’t be the only one experiencing this and once the podcast is done I may watch the entire series in a week lol"
571,"Musical moments on the show I was just rewatching College Kids and I forgot how much I like the Aimee Mann cover of “Shed a Little Light” at the Rock the Vote rally. I wish there was a recording of it. It works well with the scene too, though I’m biased toward anything Josh and Amy. The show doesn’t use music with vocals that often, but I think it’s effective."
572,"Ironically, Bernie would've been an antagonist on TWW who constantly annoyed the center-left Bartlet administration "
573,Big mistake Josh... 
574,Went to NYC this weekend to see a play (not this one) and walked by this sign. My friends didn’t understand my excitement. 
575,"West Wing Spinoff Ideas I was bored and I thought of a bunch of West Wing spinoff ideas.  Would you watch any of them?

&amp;#x200B;

**Keyworth**

Follows the psychiatric practice of Dr. Stanley Keyworth.  Each episode would be a session with a client.  If you've ever seen ""In Treatment"" with Gabriel Byrne, something like that.

**Tribbey &amp; Babbish**

Lionel Tribbey and Oliver Babbish, two former WH counsels, have started a law firm together in their post-political days.  They are the managing partners, and they have brought in Charlie Young(now a lawyer), and a stable of WW recurring characters - Ainsley Hayes, Cliff Calley, Joe Quincy, and Laurie(Sam's friend who was in law school) - for the firm.  Yeah, it's an unrealistic premise, but I have no doubt it would be good with all those characters as regulars.  Basically a lawyer show, but with potential to be more.

**Political Science 101**

Over a decade after he left the WH in scandal, this would follow Toby Ziegler as a professor of Political Science at Columbia.  Andy(still his ex-wife) and his now-college-age children Molly and Tuck would make regular appearances.  I guess his father Jules could also make an appearance or two, but Jerry Adler is 90 now, so I don't know.

We would see Toby lecturing his classes(plenty of opportunity for those great Toby monologues), dealing with students one-on-one, as a father, etc.  This would be a sort of quiet character piece about Toby.  Maybe a guest appearance now and then from former WWers, but for the most part, it would be just Toby.

**Red Lights**

Follows Josh and Donna as, post-Santos administration, they start a political consultancy firm, as full partners, and as husband and wife.

**Dr. Bartlet**

A hospital show with Dr. Eleanor ""Ellie"" Bartlet as the main character.

&amp;#x200B;

(A pair of prequels here, which would obviously need recasting for key roles)

**The Young Jed Bartlet**

This would follow Bartlet's years at Notre Dame.  Think of the flashbacks in ""Two Cathedrals"", except he's in college now.  That aesthetic.  We'd see him meet and begin a courtship with young Abbey, we'd see him studying economics and ditching his plans to be a priest, we'd find a way for young Mrs. Landingham to be there, maybe some appearances from Jed's dad.  Just the formative years of the future president.

**Hampshire**

This would follow Bartlet's years as governor of New Hampshire.  Aside from following all the political goings-on in New Hampshire(maybe there could be some run-ins with President Lassiter), we'd also see him develop his friendship with Leo(maybe we'd also see Leo as Secretary of Labor), we'd see him get diagnosed with MS, we'd see his daughters when they were younger, etc.  The final scene of the final episode would be the flashback from ""Bartlet For America"", where Leo comes to Bartlet's house and asks him to run for President.

&amp;#x200B;

**The Supremes**

This one's hardly original, but a show focusing on the SCOTUS with Evelyn Baker Lang, Christopher Mulready, and seven other fictional justices.

**Mandyville(Half joking here, but...)**

In which we find Mandy Hampton waking up from a coma she's been in for twenty years after having been shot in ""What Kind Of Day Has It Been?"".  At first we watch her re-orient herself to the world after having missed two decades, and then, after a while, pissed off, go looking for Josh and CJ to find out why nobody seemed to care or even notice that she was gone."
576,We knew them first!! 
577,"Elizabeth Moss, Martin Sheen, &amp; Josh Malina on The West Wing Reboot Rumors "
578,Wonder how much i would get for this on eBay? 
579,Just came across this Article and I’ve personally always wondered how great ‘The Newsroom’ would’ve been if for example EP 5/1 was actually titled 5/7 and the series took place covering the Bartlet WH. W/all this talk of a reboot outside of the WH DAE think this could possibly be the plan? 
580,"How did Martin Sheen never win an award? Every time I watch this show, I’m always just amazed at how incredible Sheen’s performance is. From the moment he enters the room at the end of the first episode, you just knew they had it.

How did Sheen never win? "
581,"Who’s your Mrs Morello? In the season 3 episode “Stirred”, Donna learns her favorite high school teacher, Mrs Morello, is retiring. She bugs Josh all episode, hoping to get a proclamation for Mrs Morello, with Josh repeatedly turning her down. Being the softy that he is, however, leads him to to write a memo to the President who later calls Mrs Morello. 

It’s one of the sweetest moments of the series and one of my favorites all around. https://youtu.be/InJ23OG7sn8

Donna tells Mrs Morello that it’s because of her that she is standing in the Oval Office. 

So I ask you all, who’s your Mrs Morello? Who got you to where you are and, if given the opportunity, would look to call and thank when they retire. 

Mine, too, was my high school English teacher. Because of him, my love for reading was rekindled; I am a better writer because of it; I pursued English lit in college and while I may work in insurance I still use that critical thinking and analysis. More importantly though he taught us to look at things from different angles, literally and figuratively, as he let four dorky kids film short movies for our final or reviewed The Crucible through a modern lens of discrimination. So, Mr Hashemian, if you’re reading this (and I like to believe you’re a fan of Sorkin), Thank You. I might not be standing in the Oval Office but you certainly helped me be successful in life. 

Okay. Who’s next? "
582,"I must confess I must confess that I can no longer watch reruns of The West Wing.

1. I saw all the episodes when they were first aired.
2. I saw them on reruns on Bravo at least twice.
3. I bought all the DVDs and binge watched them when I was recovering from surgery.
4. I watched them with my kids over dinner.
5. I watched them all again.
6. I re-watched selected episodes that I really like.
7. I re-watched other episodes just to make sure I didn't forget anything.
8. I started to write a commentary on the show, got through season one and part of two.

I just started to watch season 1, episode 2: Post Hoc, Ergo Propter Hoc and turned it off.

&amp;#x200B;

Is there any hope for me?"
583,"Would the “Mandy” character have worked if she was portrayed by Janel Moloney? I started a rewatch of the series and I’m showing it to my mom for her first time. No matter how many times I’ve seen these episodes, I’m still shocked to see Mandy in the Pilot. Then today I had this random shower thought: Janel Moloney’s natural chemistry with Bradley Whitford overpowered what ever was supposed to happen between Josh and Mandy, and essentially replaced Moira Kelly.

Not trying to shit on Moira Kelly, she’s a fine actress, but some people cannot speak Sorkin’s words the they’re meant to be said (pretentious, I know, but Exhibit A: The Newsroom). Mandy was supposed to be Josh’s “end-game” love interest but Janel and Brad just *worked* together, creating the inevitability of Josh and Donna’s romantic relationship. Then I got to thinking, if Mandy was played by Janel, would she have lasted and been more likable?

Janel naturally fit into Sorkin’s world and was able to land herself a permanent spot on the show, but Moira went through just the opposite. Unfortunately, Moira made Mandy an unbearable character. Janel is obviously capable of playing someone with a strong personality like Mandy’s (campaign/Santos Donna) and I imagined that if she played Mandy, Mandy could have been a character we love to hate. Janel and Brad’s ability to go back and forth, something he and Moira lacked, also would have brought a likability to Mandy. 

The show would be completely different if this happened. Even if Moira Kelly stayed on the show, what would Mandy even have done? She was always the “outsider” character and never really fit in with the rest of the staff.

Anyway, sorry if this is confusing and ramble-y but I’m curious to see what other people think of this. 

Edit: I’d imagine this scenario also including the Donna character, played by somebody else, and being more of the secondary/minor recurring character she was intended to be (like Ginger, Carol, etc.)."
584,Just finished the series all the way through for the first time. What do I do now? 
