,thewestwing
309,"Just finished Season 7's Election Day Part II (spoilers) And now I need a hug. I know it had a happy ending, and I had been spoiled on what happened to Leo, and I realize I'm over a decade late to this party. But even so, what a loss. I can only imagine what that experience must have been like for the cast, to lose someone who they had worked with for almost 10 years, and then to go on filming. If anyone has interviews about this from the cast, feel free to share. 

Not looking forward to finishing this series. Glad I watched it, I guess better late than never."
310,"Did Leo have PTSD? I was thinking about Leo’s excellent speech at the end of *Noel*, the one about a guy in the hole, and the “punchline” of his friend jumping in the hole and helping because he’s been down there before.

This is Leo sympathizing with Josh’s situation (PTSD) and remarking about his own troubles. Now, I am like 99% certain that Leo is specifically talking about his alcohol problem, but he was a Vietnam pilot who saw action and bombed targets (one that we learn could be construed as a war crime). Could Leo implicitly be saying that he too suffer(ed) from PTSD? I don’t remember the show ever implied it elsewhere, but since Josh is experiencing it and Leo tells a story that says he was in the same hole, were they hinting at it."
311,"In Hartsfield's Landing S3:E15 Bartlet tells Sam he's going to run for president one day. If Sorkin stays with the show does Sam come back and run? It just seems like this episode shows the president grooming Sam. ""See the whole board"" is the mantra. I wonder if there was some intentional foreshadowing there that never came to fruition because of the way things ended up going."
312,"Painting in Sam's office? Does anyone know the artist of the painting hanging in Sam's office? It's always intrigued me.

[Sorry for the crappy quality!](https://i.redd.it/u5hkv3s7fws21.jpg)"
313,"I forgot how good of an episode ""An Khe"" is That last scene is so beautifully acted"
314,"What would’ve happened if Santos criticized the bartlet administration during the campaign? I Personally feel like he should’ve really criticized the administration during the security leak. They really weren’t useful during the campaign and were honestly just bringing down the campaign. From taking Santos education plan to coordinating with the grand jury instead of calling for a special prosecutor. Just seemed like a whole lot of shit for him to have called them out on. Not to mention when he brings Vinnick with him after the nuclear power plant incident even though he’s the republican nominee and could’ve potentially wiped out the chances of santos winning had the press not found out about vinnick pushing for the plant. It all just seemed like bartlet didn’t think santos could win and didn’t even bother to try helping in any way he could.

Josh was right in threatening to criticize the White House when they dealt away the education plan. He should’ve recommended to santos to do that, he would’ve separated himself from the bartlet administration and wouldn’t have been asked questions when the security leak situation came to be. 

What do you guys think?"
315,"Graduation Cap ideas I am going to be graduating from University in a few weeks and would love to have a West Wing quote on my grad cap. Any ideas would be great! For reference/ideas, I am graduating with a BA in International Relations, and CJ is my favorite character. Lots of ideas welcome because I am also heading off to graduate school and any I don't use now I can for sure use in 2 years.

Thanks y'all."
316,"Can we get the West Wing on Netflix Canada? PLEEEEASE. My DVDs are long dead and scratched to bits, and I really *don't* want to look for a torrent or something similar. If it's so highly rated in the U.S., I don't actually get why we can't get it here. 

/end rant. Bah."
317,Early Brad Whitford as the demented bad guy. 1994. The X-Files Season 2 “Firewalker” 
318,Might be time to revisit the Wolves Only Highway … 
319,Interesting... 
320,My girlfriend and I just started season 5 and getting this text from my roommate kinda threw me into a headspin... 
321,"Post Hoc, Ergo Propter Hoc When Bartlett’s physician injects him with the ‘flu’ show and does the eye exam, is this a set up for his MS?"
322,"One thing that has always bothered me..... When \*\*\*\* goes down and things get legal, why does the administration call the WH Council first rather than law enforcement?"
323,"Rewatching season 5 right now. It sucks so bad. The only good plotline is the end of the ""25"" storyline."
324,"S6:E3 Third-Day Story C.J. Cregg: Gee C.J., I’m sorry your boss and dear friend is sprawled across an operating table having his veins harvested, but I do think it’s kind of neat the president single-handedly forged a major peace deal. Why don’t I write about it ’til my typewriter’s tangled up in ribbon?

Greg Brock: All done?

C.J.: Unless I’m playing both parts, yes.

Brock: Well, Jeepers, Brock, you care about Leo too but there’s a power vacuum here, and your editors don’t take puff pieces, and you haven’t owned a typewriter since the Coolidge administration.

**This** type of witty, fast-paced dialogue is one of the reasons I love this show. Also, this is my first time watching it and I was saddened to see Leo suffer a massive heart attack. He is such a well-written character."
325,"Started watching the show recently, just have one question Does the show start to build into a more overarching plot? I'm ten episodes through and it seems to me that each episode is pretty much its own separate story, bearing little, albeit some, relation to other episodes. Does the show start to build into one overarching story or does it stay like this the whole way through? Thanks."
326,"Hello, operator? I'm looking for a law firm, but I can't remember the name... (Screenshot from Sorkin's ""Molly's Game"") "
327,"The American President I have watched thru TWW multiple-multiple times. I've only seen The American President once a long time back, so I'd forgotten most of it. Good lord the similarities are numerous! Besides the future President Bartlet, Ellie Bartlet, Will Bailey, and Nancy McNally actors, the set, the walk and talk, a proportional response... there's even a Stackhouse. 
It feels like a rough draft for TWW.

And every scene that Sheen is in he just exudes president...more so than Douglas. 

Have y'all seen it? Thoughts?

*Edited to add clarity."
328,They Discuss it in the Comments! 
329,Get them started young... 
330,"Galileo 5 I love the opening of this episode. Absolutely funny, and so well written. The scene where CJ tells President Bartlet not to be a show off, and then Sam's conversation with the NASA Public affairs guy, leading to Sam writing the opening, is so beautiful! It's a real feel good scene."
331,I'm on my third watch-through rn (I know. I'm a peasant.) And i forgot to listen the TWWW this time around. The next time I watch it I'm gonna watch it with each episode. It'll be lit
332,"What are your 5 favorite episodes and 5 least favorite episodes? Also, what episodes would you be least likely to recommend to a friend to watch because it would confuse the hell out of them?"
333,Just finished the series for the first time What do I do now?
334,And he shared a birthday with Josh Lyman. 
335,This headline reminded me of the opening of S06 E05 The Hubbert Peak 🤣 
336,"18th and Potomac My wife and I got some pretty bad news today, and I was trying to think of something to relax me. The West Wing! Yes! It always calms me and makes me happy.

I pull up the next episode on my latest rewatch, and it’s 18th and Potomac. 

Maybe Seinfeld reruns instead..."
337,"Downside of Two Cathedrals The Latin in the Church is great. The stormy weather that night is also great. But has anyone else ever noticed the overwhelming falseness of the actual drama?

&amp;#x200B;

1. ""We need to have a discussion and we need to have it tonight.""   &lt;----Multiple people are adamant that there must be a discussion and yet there was never a discussion
2. ""It's answer B"" &lt;----Josh tells Toby that the president isn't running again and we go to commercial and come back after the interview where President Barlet tells the world he has MS (Side note, the TV interviewer didn't ask if he was going to run again?)
3. ""First row, first seat on your right"" &lt;---CJ is adamant that the president needs a softball question about his health when it's already been stated that ""it's answer B"" (Which we would assume the interviewer would have asked about)
4. No one in The West Wing (the support staff) seems to have a reaction to the President admitting he has MS even though we're told that 60% of Democrats won't vote for him because he lied by Joey Lucas (played by the amazing Marlee Matlin)

&amp;#x200B;

So the president lied. His staff is upset that he lied. Then they all demand they form a plan together and the **president cuts them out again** (makes the decision without them). Then &lt;spoiler&gt; he completely changes his mind again after telling no one.

&amp;#x200B;

If you're a senior staffer - why would you trust him at this point? They all have to hire (and pay) lawyers now because of this. 

&amp;#x200B;

Jesu, tibi opus vitae."
338,Jed speaks out about money in politics 
339,"Facial expression Leo McGarry/John Spencer (I'm sorry if this is a repost)

In flashbacks his facial expression is very different from his usual face. Squintier eyes, smile, a more carefree expression. 

1 exemple is in ""Bartlet for America"" at the beginning of the first meeting between leo and governor Bartlet.

 I think they did a really good job of that. I also hope i'm not the only one that noticed this.

Thank you for reading."
340,"Absurdity of the Danny Concannon/Sharif Plot Even IF I assume Danny - a WH correspondent who would have no reason to go into the field for a story - went to Bermuda looking for a lead on Sharif and not just vacation, the rest is ridiculous only-on-tv nonsense (almost Deus Ex Machina-esque). He sees guys playing cricket, a game he doesn't even know just to talk about it? AND he meets the one Bermudan who was at the airport and met US SOF at the gate?

It seems right up there with the other s4 absurdity of Bartlett destroying Ritchie and yet he doesn't claim a single majority of Congress...

Rare for Sorkin, but maybe on his way out he got less thorough with keeping the plots tight?"
341,"Season 4 Ending Recently started my rewatch of the show, and I just realised how amazing the ending of Season 4 was. Pity Sorkin left right after that. "
342,Newest addition to my favorite cheap and late night DC spot! DC Cafe has walls plastered with celebs so I was pleasantly surprised to see this :) 
343,"I have a challenge/request for people, can someone summarize the biggest event(s) that happened in each season? "
344,I always wondered what Toby was doing before politics. (Spotted in the Saved by the Bell wedding special) 
345,I think one of the designers working on Slack also worked in the Bartlett administration 
346,"Not to be 'that guy' or anything but how can they play Bradley Whitford like the cool, sexy, charming one when you have Rob fucking goddamned Lowe acting opposite in almost every scene?

am i missing something? 

have beauty standards really changed that much in the last 20 years?

"
347,C.J. Cregg's Stalker in the Dept. Store Do you think he's actually caught on film in the background? Do you think it's as obvious as them talking about a guy in a coat?
348,We’re it. You and me. This is the back room. 
349,"Life in Pieces Has anybody been watching this show?  I only mention because there are a couple of Sorkin players in it, someone suggested it to me last week and half way through the first season it's quite amusing."
350,What character in Mandyland do you wish became a regular on the show? My pick would have to be Ainsley Hayes. I think Emily Procter was outstanding in that role and the character was a good fit. It was nice to have her as a recurring character for a few seasons but I would've loved to see more of Ainsley. 
351,"Cast Let's assume the show was renewed for three more years. It would have had 10 seasons. What could the cast list look like for seasons 8, 9, and 10 since the original administration and cast was pretty much out of office by the end of season 7?



"
352,"Underrated scene imo: when Abbey says “You’ve got lots of nights” Season 4 Episode 7: Election Night.

I love the last scene with Jed and Abbey talking when she realizes he’s having a mini episode I guess you could call it. The two of them talking about the next term quick is fantastic. They play a real couple so well. "
353,HPV vaccine linked to 'dramatic' drop in cervical disease! Good Job Ellie Bartlet! (and all of the non-fictional scientist and doctors!) [https://www.bbc.com/news/uk-scotland-47803975](https://www.bbc.com/news/uk-scotland-47803975)
354,"Jordan Kendall, J.D. Season 3's underrated heat-check (basketball term) preformer. Such a wonderful and well-written character who has to handle the second most powerful man (Leo) on the show - and not always when he's at his best.

It's Jordan who sees all along that a centure is the best course of action for the White House and is relentless in getting that across to her client. She's intelligent, direct and has great style too. The scene where she asks Cliff Cally to move the Capitol Police to the other side of the hall is a reasonable presentation of her vulnerability that doesn't wreek of femine subservientness.

Thoughtful and developed minor characters should be celebrated. Just thought I'd share. What's next?"
355,"So like am I the only one who’s HATES Will and Donna during seasons 6-7??? So personally, I liked the characters for a big amount of time until 1.) Will got hired by the VP 2.) Donna joined the VP campaign. Here’s why:

- Will just seemed like such a pain in the ass, for example during Bartlet’s trip to China during 6x09 and 6x10. The president has an MS episode and while there are already physicians etc lined up to speak to the press, Will takes this as a time to make sure the VP gives a statement and the damn VP goes along with it and just to stick the knife in further, Russell uses that damn line about playing tennis when he heard the news, it just seemed to me that neither Russell nor Will had any type of respect for the president or the country since this clearly was a campaign stunt for them. Another instance was when during the SAME episode, they tried holding a damn cabinet meeting where they clearly were going to try and invoke the 25th amendment on Bartlet. That just showed so much disrespect and left a sour taste in my mouth.

- Another instance was when baker visited the White House and Will inserted Russell into the photo op to avoid it only being Bartlet and baker. Bartlet himself even told Russell never to do that again, he even said that he wasn’t choosing between either of them so it wasn’t even anything to do with the campaign just baker and the president taking a photo with some historic thing (I forgot what it was). Personally, I think Bartlet should’ve fired Will’s ass after that incident. It’s still his administration and still him governing till the final minute. 

- Donna really came off to me as annoying and full of herself when the New Hampshire primaries came around. She didn’t finish college and just expected a promotion to come her way because she worked in the White House under Josh for a long time. Will coming up to her with a job offer was definitely a little punch at Josh and Donna accepting was also a big backstab. She considered herself to be on Josh’s level of expertise just because Will gave her a job, she wasn’t even in charge of anything. I remember one quote from 6x11 where she says sarcastically “Yes, I let Will seduce me with a salary and actual political support” political support how?? Bingo bob had none lmao it’s why his ass was neck and neck with Santos at the convention. She’s literally just working on media targeting like come on. She makes it seem as if she’s on the same level now and tries to throw it all in Josh’s face. 

Another moment that really irritates me is when she tries to get a job at the santos campaign and she tries to dismiss the comments she made about santos during the campaign as “doing her job”. The quote that really pissed me off was her saying “You’re not used to seeing me in a position of power, I can see how that makes you uncomfortable.” It’s not even that, it’s the fact that she felt a little bit of power and instead of using it for good like Josh she used it to slander opponents and gain a few fractions in the polls. It put a smile on my face when josh didn’t even let her get past the interview stage. She Deserved every bit of that.

Final case: they’re both shitty characters in the end tbh. It kinda pissed me off that she ended up working for the campaign and santos administration in the end but oh well. The fact that Josh didn’t even ask Will to stay on was also pretty dope tbh. Sucks that he became a congressman later on, I feel that more than likely josh didn’t tell santos to help him out when he started campaigning. If he helped Russell more than likely he shared some views with the VP.
"
356,"""Lies, Damn Lies &amp; Statistics"" So in Season 1 Episode 2 - Sam tells Laurie ""There isn't a BAR in America that's going to admit you with a solicitation bust on your record""

&amp;#x200B;

And then in Episode 21 of Season 1 - We find out that the picture of Sam and Laurie was setup by her friend who also confirmed to the media outlet that published it that she was a call girl.

&amp;#x200B;

When the President finds out, he says he will personally see to it that the A.G. admits her to the BAR.

&amp;#x200B;

So, by meeting with Laurie (after being told not to) and using her friend - Is it possible Sam basically ruined the career of a would-be lawyer before it could have even gotten started? And after she had claimed she only was a call girl to pay for law school (which is now worthless and she did all of that illegal activity for nothing).

&amp;#x200B;

I'm wondering if that's a (or one of the) reason(s) we never heard form Laurie again."
357,How time flies! 
358,"About Season 4's Commencement I watched the episode this evening, and had to leave immediately afterward to attend my child's music recital. Not skipping my kid's performance to watch ""25"" is one of my more impressive acts of parenting.

If anyone wants to chat about these two episodes, feel free to comment!

&amp;#x200B;"
359,A real presidential candidate tours his new HQ in all too familiar fashion 
360,"Just realized Josh lost two fathers to the Presidential elections First time around his own father died because of a pulmonary embolism and the next time Leo died because of a heart attack

Coincidentally it was Donna who had to give him the news both times. "
361,"""This guy was in the Final Four!"" "
362,After spending way too much money and not having to beg the streaming services. Both are the Complete Series. The Newsroom to come next paycheck. 
363,"Donna’s Job Offer In Night Five (S3, ep. 14), Donna is offered to be issues director for capitalscoop.com and the dude writes down a number. Donna assumes it’s their operating budget but it is in fact her potential salary. 

What is the number? Every number I can argue for I can easily argue against."
364,"Do you believe the characters in the show are reasonable analogs for people who work in high politics/ high anything? I ask for a couple of reasons:

1) Every time I watch TWW it makes me want to be a better version of myself. It makes me want to be more informed, more educated, more articulate. No other show ever makes me feel the same way. However, on the flip side. 

2) The characters in the show really make me feel like shit about myself sometimes. I didn’t go to an Ivy League school, I didn’t score a 1590 on the SAT, and I don’t think I have the ability to work 18 hours a day like they seem to do in the show. 

I only wonder because if the characters in TWW are a reasonable representation of the type of people who work in the highest levels of anything then it makes me feel like there is definitely a ceiling on my capabilities and potential achievement. Anyone else feel this way?"
365,Are Lloyd and Bob Russell related? Should Bingo Bob have hired Mandy for his campaign? 
366,"So I rewatched season 7’s last few episodes...Santo’s is such an ass**** The last season is passable, I enjoyed the whole campaign plot and what not. I just didn’t end up liking santos as much as I did when we first meet him in season 6. Here are a few reasons and ill try to cite certain episodes.

- He treats josh like a second thought even though this is the guy that pretty much got him to the fucking White House. For example in 7x09, we have a bunch of people recommending that josh be let go as campaign manager, and santos just takes it and doesn’t try to defend him at all. I think it’s BS that he ended up turning his back on him like that, I especially hated that he took Goodwin’s advice when Goodwin tried acting like an alley to josh earlier in that episode. (More on how much I hate Goodwin later.)

- Goodwin comes out of nowhere and honestly has no real connection to Santos during the campaign. Yet for whatever reason santo’s always seems to go along with Goodwin like when wanted to head the transition team he let him do it. Or when he wanted josh replaced by Leo as campaign manager, he once again willingly listened. I remember during the speaker race that josh wanted santo’s to remain neutral but santos kept mentioning how Goodwin thought he should throw his support behind his old pal. It just seems to me that santo’s didn’t feel as if he were in josh’s debt and that the only person that’s really looking out for him is josh.

Overall, it’s not surprising that so many AU’s have santos being a one term president tbh. He’s just so damn flip floppy when it comes to his own team especially josh and tbh if Goodwin was a part of his administration then that for sure concludes that his presidency would’ve been one term. He’s more willing to listen to anyone that he thinks has something important to say when really the only one who should be helping him out is his chief of staff which is josh.
Even he realizes that santos is looking for a yes man during the transition which I personally think is ridiculous."
367,"I just read "" Ten Days in a Mad-House"" by Nellie Bly and you should too Hello all,

I just finished reading "" Ten Days in a Mad-House"" by Nellie Bly. I got in from my library on a lark and was fascinated by it. It is not particularly long and you can finish it in a day if you don't have much to do. 

I read it because I came across it and am a West Wing fan. I finished it with a greater appreciation for the work of a woman who put herself in harms way to tell an important story. "
368,"2 Cathedrals My current and umpteenth rewatch just passed 2 Cathedrals. I've never previously understood, why this episode was such a favourite for many, and particularly didn't like the ""false cliffhanger""at the end, but this time I truly appreciated the episode, and understood why it holds such favourite status to many.."
369,"A war he wanted nothing to do with... I’m curious, President Bartlet didn’t serve in Vietnam, how did he avoid the draft? Was it age? Was he studying in London? Does anybody know or have a theory?"
370,"I have a question: I was on a date with someone.. And I didn’t know she was into TWW. I referenced a scene in the Oval Office 
and I said “Bartlet”, she awkwardly interrupted/corrected me and said: “Mr. President, but go on”.

So should I buy the ring with a moissanite or diamond?"
