,thewestwing
0,"A long time ago I posted my (incomplete) West Wing floor plan that I created from DVD special features. I'm back at it and updating to reflect all the set changes I can find! [My original post, six years ago.](https://www.reddit.com/r/thewestwing/comments/11277o/my_west_wing_map_stitched_together_from/)

~~Gallery of my updates!~~

&amp;#x200B;

EDIT: [This should be the correct working album link, sorry all](https://imgur.com/a/nDs4cKj)

&amp;#x200B;

Years ago I started a little passion project of trying to reconstruct a floor plan of the set of The West Wing from screencaps I took off the DVD special feature tour of the set. A recent rewatch of the series sparked my drive to start working on cleaning it up some more in Photoshop and adding to it. The set was built with doors galore and lots of extra space that could get used for future changes, and it's fun to see different little areas appear and evolve throughout the series. The most obvious is the creation of a whole press bullpen area for season 5, but there's other interesting things like the fact that they finally showed where at least one bathroom is in season 5, too. I just wanted to share my progress and maybe start some interesting conversations about what the reddit WW community thinks of the way the set evolved over the years.

EDIT 2: I realized I misspelled “colonnade.” I’ll fix it at some point."
1,"The ending to ""S1:11: Lord John Marbury"" Gosh, I literally never post on here, and have seen this episode dozens of times and it always gives me chills. Sorkin's ability to have his characters quote the bible in a way that relates to the plot without shoving religion down your throat is just... impressive. And the actual quote is scary while simultaneously being fascinating &amp; ominous. And the way His Lordship comes off as a cartoon &amp; yet is able to truly flex his intelligence to counter-balance it makes him such a fun, well-written, dynamic character. But the timing, oh man the timing further sets the entire scene, just the way the lighter lands in his hand from an off-screen Bartlet after His Lordship asks for it again, as well as it fading to black while hearing the lighter go off; man, this scene is a wonder.  


But I've never, \*ever\*, noticed Leo quietly laughing in the background! And boy oh boy, that sure brought me so much joy. Because damn, Lord John Marbury is just the coolest &amp; just enough ridiculous. That's all. I just had to tell someone that &lt;3 &lt;3 &lt;3"
2,Not the steam trunk distribution venue! 
3,Happy anniversary President Newman 
4,So I'm making a fake US iTunes account to take advantage of the offer... 
5,"I’m Marion Cotesworth-Haye! Jesus why is this funnier than I remember?

 I don’t even find it *that* funny when Marion Coatsworth Haye introduces herself, it’s when CJ bursts out laughing afterwards is when I lose it. 

“I’m sorry. I was...I was thinking of this thing from...this thing that just happened with the deficit.” 

Her voice on the word ‘deficit’ kills me. Honestly just made my night better 😂😂😂"
6,"What to watch after The West Wing I've just completed my 5th rewatching of the full series of The West Wing. We also recently watched The Newsroom and Studio 60. Have watched Sportsnight previously as well, so I'm looking for options outside the Sorkin-verse. 

What should I watch next? I need something to satisfy my need for a top-quality political drama. 

I've seen House of Cards and thought that was good (especially early seasons) in a very different way obviously. 

Considering:

1. Designated Survivor - saw a few episodes on ABC early on and thought the writing wasn't great.  Does it get better?

2. Scandal - haven't seen a minute of it. Is it too much soap opera?

Any other suggestions?"
7,"Did anyone else wonder if Trump had a ""wrong speech in the teleprompter"" moment like when Will and Toby write their mocking speech in for Russell's inauguration? Season 5, episode 4, Will and Toby are having a hard time writing for an uninspiring VP choice, and write a speech mocking him. It accidentally goes on the prompter and Pres Bartlet has to wing it on the spot. 

&amp;#x200B;

July 4th Trump talks about airports and jets in the American War of Independence, the internet goes wild with memes. Was one of his own speechwriters mocking him and forgot to switch out? (Likely he was just rambling off prompter, but this way is more fun to imagine)."
8,"iTunes $29.99 Complete Series Deal iTunes has the West Wing complete series for $29.99. This is the lowest price I have ever seen for all of the episodes. 
I’m pulling the trigger before West Wing goes the way of The Office on Netflix."
9,"What moment or eppisode sticks with you the most? This show is full of quotes, moments, and just great life lessons ( good and bad). It was the first show that ever made me cry ( leo's death, actually john spencer but when they did it on screen that just hit me), the first show to make me believe in something ( that the government can actually function if they try) and the first show to make me realize how the world kinda works( the government doesn't really try, they just bicker) 

&amp;#x200B;

Random things stick with me, but what stays with you? Is there a WW quote or storyline that rattles around in your head? Maybe just something you remember once in a while that makes you happy."
10,"My kid has been humming along with the theme song for about a year now. Not super great sound quality, but it cracks me up every time! "
11,"Jefferson Lives. Happy Fourth, everybody."
12,Will Bailey really went from the man of ideals and willing to run a dead man to prove points to going the safe route with Russell and getting burnt. He went from a great character that I loved to just being a nuisance. What happened over 4 years to make him basically a 180 as a character? 
13,"What are the two best episodes of the West Wing to get them hooked? For our nation's 243rd birthday, I will be showing my friend this show, but we will only have enough time for two episodes. I am just not sure which episodes would be best. I am thinking Galileo 5 and Mr. Willis of Ohio, thoughts?"
14,"What are your essential episodes to watch from each season? If you were to rewatch but weren't able to do a ""straight through"" watch... Which episodes would you make sure to watch from each season? I'm making a list of such episodes. Reasons why would also be appreciated!"
15,"""If you were in an accident I wouldn't stop for red lights."" "
16,"Sam Seaborn for President Rewatching in Netflix. 

I'm sure it's been brought up (many times). In season 3, episode 15, 'Hartsfield's Landing' Bartlett tells Sam he'll be president some day. Any ideas on why we haven't had a West Wing reboot with Rob Lowe as president? With so many shows being brought back, why not?"
17,"...this country is an idea, and one that's lit the world for two centuries and treason against that idea is not just a crime against the living! This ground holds the graves of people who died for it, who gave what Lincoln called the last full measure of devotion, of fidelity. "
18,Did NBC miss our other call President Bartlet Jed and not Jeb? You know... since his initials were JEB... Josiah Edward Bartlet
19,"Happy Canada Day, Donna! "
20,Close enough. I wonder if Martin Sheen gave Bradley Whitford some tips? 
21,"Just watched Election Day part 2 S7, E17.

I teared up a bit when they found Leo. I can't imagine how the actors and crew dealt with the real life death of John Spencer and then had to act in that script. 

I know TWWW hasn't quite made it to this episode yet, but does anyone know of any material describing how they decided to write this, and how the cast and crew handled it?  

I had trouble thinking of Leo's last on-screen appearance and felt ashamed for not remembering.

There are a few episodes that tug at my heartstrings, but I was truly saddened to know such a great actor left us too soon, with at least one story only partially told."
22,"West Wing ruined me for other shows Mostly, because  the show is so great.  But also because I can’t take the actors seriously when they are in other roles, because they will always be the WW character. 

Example. I watched Parks and Rec before WW... and during a rewatch tonight, I just can’t take Rob Lowe seriously as Chris Treager 😂😂"
23,"Question about the convention 6x22 I never understood how in the fuck Baker managed to mess everything up the way he did. Like he literally came out of nowhere (after deciding not to run) and took a big chunk of delegates and seemed likely to be the nominee. Causing nothing but damage especially after the depression story about his wife came out so I have a few questions 


Q1: how the fuck did he manage to do that and why did the delegates even have faith that he was the man needed to be the delegate?

Q2: Would a candidate realistically be able to do that? The convention was already a mess and baker seemed to have caused even more damage.

Q3: Baker seemed untrustworthy in my eyes after he pulled that stunt, why would santo’s trust him for VP?

Q4: it seemed clear from the start that he didn’t stand a chance against vinick either, why tf didn’t Leo step in and tell him to buzz off like he did with santos?"
24,Am I to suppose that Josh Lyman threw a curve ball under everyone's nose in Bartlet for America and never gets the credit? I'm on my second watch. 
25,"...Mr. Latham, the head of The White House Military Office or ""WHAMO"", as we have apparently taken - over my strong objection - to calling it. "
26,Characters Did anyone here actually like Mandy or was sad when she left the show. I wasn’t
27,"Sweet CJ and Danny moments Watching the series again, I realized how many adorable moments there are between CJ and Danny. What are some of your favorites?"
28,Question about A Constituency of One This is the episode where it is Josh’s birthday. It is also where Josh chases Senator Carrick away from the Democratic Party. Here is my question. Is Carrick stumping for the same anti-ICBM system that Leo is touting in Season 1? Why are Leo and Josh suddenly so against it?  Did Sir Joh Marbury make an exceptional argument to sway them?
29,"Why is S6E2 called ""Birnam Wood""? I understand the reference is from MacBeth and the prophecy of how MacBeth will die when Birnam Wood comes to him. But I don't see how it relates to the story in the episode."
30,"Juxtaposition Just started a West Wing rewatch and got to the first scene with Josh and Zoey.  A delightful moment in the kitchen with a pot of chili and a fascinating juxtaposition with their interactions in Handmaid's Tale.  I tried to find it on Youtube but the best I could get was the bar scene in the next episode. ( [https://www.youtube.com/watch?v=h3vW1X4HlNU](https://www.youtube.com/watch?v=h3vW1X4HlNU))   Still, I recommend watching Eps. 1:5 and 1:6 if you need a respite from delicious depression of the scenes with Commander Lawrence and June."
31,Photo of Clinton/Gore in background of S03E15 
32,"Favourite episode? i think it would be a strong competition between Two Cathedrals, In Excelsis Deo, 20 hours in America 1 and 2, and one or two of the campaign-centric episodes"
33,"I watched Charlie Wilson's War (screenplay by Sorkin) At the beginning, a producer is pitching an idea for a TV show to Tom Hanks's character.  He describes it as ""Like Dynasty, but set in Washington"".  He was pitching The West Wing."
34,"With the recent news about the office moving to NBCs streaming platform, does that mean The West Wing will move too? "
35,"Is CJ based on E Jean Carrol? I couldn’t find any mention of this on the internet, but they may be drowned out by E Jean’s new news. 

She’s a female American journalist circa 1993, and then we get CJ (or as P. Bartlet calls her once: C Jean) Cregg in 2001.

Coincidence?"
36,Will the West Wing ever be released in Blue Ray? 
37,"The Musical Detail in “The Warfare of Genghis Khan” (S5:E13) I don’t know if anyone has appreciated this yet but there is a cool little “Easter egg” of sorts in the episode where Josh is at odds with the NASA “geeks” (as Donna calls them). In a scene towards the end of the ep, Josh is seen lounging in his apartment until there is a knock at the door where a NASA scientist has left him a telescope. The background noise is the song “Dark was the Night, Cold Was the Ground” by Blind Willie Johnson. The significance of this song is that it was included on the Voyager Golden Record, a disc sent into space by NASA in the hopes that it would be recovered and researched by extraterrestrials. The Record includes many images, songs, and symbols that help to explain the Earth and mankind. These little details make the show that much more enjoyable!"
38,"The most effective use of ""Hallelujah"" on a television show was at the end of Posse Commitatus and no one will ever convince me otherwise (I'm not crying you're crying)"
39,"Imagine if there was only one person to do CJ, Toby and Annabeth’s jobs "
40,Lionel Tribbey did it better with that cricket bat he carried around 
41,Xpost: a study of prayer for cardiac bypass patients found that prayer had no effect on recovery and that patients who knew they were being prayed for actually had more complications 
42,"Help finding a specific episode: retaliatory attack Since last week's real-life events (called-off retaliation attack on Iran), I've been trying to remember the exact episode in which a retaliation attack is weighed and someone (Bartlet?) is musing over the fact that, despite the choice of an early morning time for the bombing so as to minimize casualties, there will be a janitor taking his shift who will be killed in the scheduled explosions. Does that ring a bell? I don't think it's 1x03 ""Proportional Response"", I rewatched a few scenes from that one and couldn't find the dialogue."
43,The Introduction of Nancy McNally is an Underrated Moment in West Wing I am on my umpteenth rewatch of the show and I noticed now how perfect Nancy McNally's introduction to the show is in S2E1. She just appears and it took me until now to realize this is her first appearance in the show. She just naturally appears and is part of the scene. Its very impressive to me at least.
44,TIL some people still don't know this. 
45,The Leak - Military Shuttle Do you think Toby really did leak the story to Greg Brock?
46,"two of my favorite actors, one of which was in West Wing One of the great things about The West Wing was the character actors who showed up.  Sadly Wendell Pierce was not one of them.

&amp;#x200B;

[https://twitter.com/WendellPierce/status/1142798482874470401](https://twitter.com/WendellPierce/status/1142798482874470401)"
47,"Why would anyone care that Andy's pregnant? I'm re-watching season 4 and I'm on the episode right after the election. Process Stories. The one where Toby is trying to get Andy to put out a statement about her pregnancy and remarry him. Why would the constituents care that she's pregnant or divorced? One of my senators had a baby last year and it was news, but otherwise a non-issue (other than babies being allowed on the senate floor now). Or have things really changed that much since TWW aired?"
48,Charlie McCarthy was the dummy. Edgar Bergen was the ventriloquist. 
49,"A new style of rewatch Spoilers, if it matters. 

I will preface this by saying I am a die hard fan of the show and have watched it back to front many times. Recently I realized that the last couple times I did a real rewatch I stopped after season 4 because I dreaded the second half of the show so much. In an attempt to reinvigorate myself on seasons 5-7 I decided to start this round ON season 5. 

It’s been a revelation. I honestly am really enjoying it. I think I was so attached to the core team that I just couldn’t accept seeing others on the screen. And the schism between Josh and Toby always depressed me. Don’t get me wrong, still hate that plot point, but I can appreciate the device it is a little more this time. And I really enjoy watching Santos and Vinick. I think they are great characters and are each acted extremely well. I also love seeing Donna and Josh finally get
together. 

Anyways, just wanted to share in case anyone else has avoided the last couple seasons for awhile. Try them on their own without immediately coming off the good stuff. There’s a few stinker episodes in for sure but I think it’s a good way to appreciate it for what it is instead of comparing it to the golden years."
50,What if Vinick won? 
51,"Donna is kinda annoying. First, i've watched the West Wing at least 20 times in the last 10 years. I know its weird, I get shit from my friends and family all the time. Rewatching currently and I'm starting to notice that Donna is really annoying sometimes. She asked was to many questions and always seems to be up in everyone's business. Episode were Jack Reese is transferred for giving POTUS a force depletion report. She is talking about the buttons on his pants, telling Josh she saw reports about Naval forces in the Pacific. Then when Jack gets in trouble she starts asking way to many questions. IDK maybe i'm crazy but she sure is bougie AF!!"
52,Anyone else trying to balance an egg on its end today? 
53,"Season 4 Finale Does anyone else think that Aaron Sorkin was a little insane to write the season four finale, knowing he wouldn't be back for season five? ""Here staff writers. Have fun with this enormous mess I created."" 

(I'm assuming he had already made his plan to leave when he wrote that episode.)"
54,"Question about 1x21 (Lies, Damn Lies, and Statistics) I never understood in this episode why Charlie had the run-in with the ambassador Ken Cochran. Ken recognizes Charlie where Charlie's introduces himself as the waiter at a club. This was clearly a point of contention, but why? Was is a racist Club?"
55,Toby/CJ I would like to hear some discussion about people’s thoughts on their relationship especially in the later seasons
56,"Which song is played at 6x19 intro? I have been looking for a very long time for the title of the song that is played at the intro of 6x19 episode, Ninety miles away, when Leo is in Cuba. Is like a sad guitar solo with a touch of classic cuba/Caribbean music. If somebody knows, please say it, I really want to listen the full song, thanks."
57,A Proportional Response: NYT: Trump Stopped Strike on Iran Because It Was ‘Not Proportionate’ 
58,"Reflecting on the impact this show had on me, particularly President Bartlet and Leo. I’m 46, a former Republican, now progressive. I know characters are an amalgamation of writing, performance, editing etc.  But like many, when I see Martin Sheen I see President Bartlet.  Martin Sheen and John Spencer left an indelible mark on me as those two characters. Somehow I felt so comfortable with them that I would see them in my dreams on occasion. Somehow we’d have already met and quickly fell into pleasant conversation. 

I credit the show with a change in my view of government. One where positive change could be effected even if only in small steps. I later went on to live in Denmark and saw firsthand what a government can be like that regularly strives to improve life for all of its citizens.  

In these days it could easily be dismissed as a pipe dream but it doesn’t have to be. If we choose to fight for the better version of ourselves and push for a better version of this country it _is_ possible to make things actually better. Not just better for some, not just a temporary superficial better but one grounded in our most fundamental values like the golden rule. There are plenty of bad actors prepared to create and maintain a lopsided version of “good” but I firmly believe there are more of us who want to see a better future for all.  

Watching the video that was just released featuring several celebrities including Martin Sheen reminded me not the let my anger get the better of me. Leading me into a smoldering stupor.  It reminded me to keep my eyes clear, support this vision of the future in every way I can and not succumb to the cynicism of the age that tells us real change, real justice are fairytales.

Thank you West Wing for showing a vision of flawed people genuinely trying to make this country a better place."
59,"I, and two congressmen "
60,"Which is scarier: Tim Matheson trying to get the presidency, or Tim Matheson trying to sell you a Chucky doll? "
61,"Love for Charlie I just wanted to post and give some love to Charlie. Dry humor, good wit, a man of integrity."
62,John Wells on TWW reboot 
63,"Bird beak The bird outside my window is telling quite the story in Morse Code!!  I don't know Morse Code so instead I'm channeling Donna: ""Stop it, you'll hurt your beak!!"""
64,Someone must be concerned about virtue. 
65,"Favorite guest star? There's a lot of notable guest stars on The West Wing (some of which I didn't even realize/recognize until after a couple times watching through).

Who are some of y'all's favorite guest stars?"
66,Leo wouldn't have let this happen 
67,Discussion: Season 1 Take This Sabbath Day I love. LOVE. this episode. I’m a Christian and watching the final scene is super powerful for me. I honestly think it’s one of the greatest episodes in television history. Love to hear what y’all think though
68,"Season 5 Episode 11 Benign Prerogative Question \*\*\*\*Answered!!!\*\*\*\*

&amp;#x200B;

Please forgive me if I'm asking a stupid question, or maybe I'm just bad at subtext, but sometimes with this show and many Sorkin shows, there's a lot in the subtext. Sorkin goes for substance and it's been my experience that he enjoys clever wordplay and deeper meanings. That said, this one line trips me up.

&amp;#x200B;

Charlie is showing Meeshell around the White House as a date. He takes her to the press room to show her where CJ addresses the press. Meeshell informs him that she'll be joining the press corp. Charlie becomes angry and informs her that everything he said and did during their day together is off-record and she is never to mention anything. He then says, ""He's not just the president.""

&amp;#x200B;

What exactly did Charlie mean by that particular line. Is it because he considers Bartlet to be more than just his boss, more than the president, but his friend and his father-figure?"
69,"Who gave Bartlet the napkin? Was rewatching the finale recently and this bothered me. Who on earth gave Bartlet the famous 'Bartlet For America' napkin.

Leo wrote it down and presented it to him when he was Governor and convinced him to run for President. Bartlet then gave this to Leo at the end of the BFA episode. Bartlet then receives it as a gift at the end of the finale. Who gave it to him? Did Leo do that before he died? Was it Josh? Mallory?"
70,I love The Long Goodbye Bottom Text
71,"Spoilers S7 









I’m not sure how to use spoiler tags on mobile so I hope this works and I’ll just delete it if it doesn’t. 

So, near the end of season 7 at Leo’s funeral we see The President, Josh, Charlie and Matt Santos as pallbearers. I’m wondering if anyone knows who the other two men were. And why wasn’t Toby one? Was Rob Lowe doing something else at the time because I would assume Sam would have at least been at the funeral."
72,"Worst West Wing Episode? Season 5, Episode 21: “Gaza”—Donna’s melodramatic narration and tryst with photographer is straight up ridic—and NOT having Josh and Donna get together after that was just stupid. 5 seasons of Ross and Racheling” is just disappointing. Worst, but there are other similarly bad episodes. thoughts?"
73,"Taking one from the Bartlet playbook, I see. "
74,Fantastic Joke 
75,"Top/Best/Favorite Episode of the Run? I'm halfway through my third watch of the series, and I just hit S04-E06 - Game On. For me, it's the single best episode of the entire series.

It manages to:

* Demonstrate all the best parts of all the characters

* Introduces Will, who is one of the strongest pieces of the ensemble in the latter half of the series

* Show perfectly how well Sorkin can write when he's really on it.

* Throw in the fact that it was directed by one of the best talents who worked on the show (Alex Graves, who also did In In Excelsis Deo, Galileo, Dead Irish Writers, Posse Comitatus, The Stormy Present, The Cold [another favorite]), and a bunch of others), and it just ticks all my boxes.

&amp;nbsp;

But I'm just one person. What do ya'll think is the best episode in the run? This doesn't have to be the objective best, although I think Game On is, it can also just be your favorite."
76,Martin Sheen | 2019 Commencement Address 
77,"I changed my major because of Joey Lucas Whole that's not quite true (I changed my major because of a job I had doing fundraising analysis for a large national non-profit) Joey has always been an inspiration. She is educated, hold and had more integrity than I can imagine. I will one day be here, though less attractive, she is an incredible character and I am so glad to be getting my degree with her as a model."
78,"Help with a quotation? Hey guys, I'm having trouble remembering the exact wording of something and was hoping that you could help me out.

I remember the context being Leo and Bartlet arguing about parenthood (?), and the exchange goes something like Bartlet admitting that one of his daughters pisses him off and Leo responding with a short, kinda angry speech, one of the lines of this speech being ""they're supposed to piss you off"". If this doesn't ring any bells feel free to tell me that as well. Thank you!"
